{
  "accepted_corpus": {
    "corpus_id": "v1-initial-vo-2026-08-07",
    "decision_id": "v1-initial-vo-2026-08-07",
    "entry_count": 1,
    "failed_entry_count": 0,
    "passed": true,
    "passed_entry_count": 1,
    "results": [
      {
        "failures": [],
        "passed": true,
        "pattern_id": "pattern-v1-0000000000000000000000000000000000000000000000000000000000000000",
        "raw_event_name": "Play_vo_Example_Q_cast"
      }
    ],
    "review_status": "pending"
  },
  "decision_id": "v1-initial-vo-2026-08-07",
  "experimental": {
    "blocking": false,
    "promotion_candidate_pattern_count": 0,
    "promotion_candidate_record_count": 0,
    "record_count": 0,
    "render_status_counts": {},
    "top_warnings": []
  },
  "gate_version": "stable-product-gates.v1",
  "global": {
    "pattern_count": 1,
    "record_count": 1,
    "support": {
      "pattern_counts": {"stable": 1},
      "record_counts": {"stable": 1}
    }
  },
  "schema_version": 1,
  "scope_contract": {
    "actual_pattern_count": 1,
    "actual_pattern_ids_digest": "86b9aaa226ad983b706339dcc5a853e5165867dc188acfcac48f08ce2588a083",
    "actual_record_count": 1,
    "decision_id": "v1-initial-vo-2026-08-07",
    "expected_pattern_count": 1,
    "expected_pattern_ids_digest": "86b9aaa226ad983b706339dcc5a853e5165867dc188acfcac48f08ce2588a083",
    "expected_record_count": 1,
    "matched": true
  },
  "stable": {
    "approved_pattern_count": 1,
    "passed": true,
    "pattern_count": 1,
    "record_count": 1,
    "require_zero": true,
    "residual_english": {
      "record_counts_by_category": {"ability_key": 1},
      "top_tokens_by_category": {"ability_key": [{"record_count": 1, "token": "Q"}]},
      "unique_token_counts_by_category": {"ability_key": 1}
    },
    "violation_counts": {}
  },
  "status": "passed",
  "unsupported": {
    "asset_kind_counts": {},
    "blocking": false,
    "record_count": 0
  }
}
